Name,Price,Price1,Sold,Star1,Star2,Star3,Star4,Star5,Link,Rating
M8 Ultralight Wired Gaming Mouse Lightweight Honeycomb Shell 6 RGB Breathing Backlit Mice 6400 DPI USB for Win Xbox PS4 Mac HP,8,SG$23.74,,,,,,,,No Rating
SKYLION F1 Wired 3 Keys Mouse Colorful Lighting Gaming and Office For Microsoft Windows and Apple IOS System,1.36,SG$5.76,,,,,,,,No Rating
M1 Wired Lightweight Gaming Mouse 69g Ultralight Honeycomb Shell RGB Chroma Backlit 6400 DPI Ergonomic for Laptop PC Mac Gamer,7.9,SG$23.49,,,,,,,,No Rating
1 PC ITLY New Hyperspeed USB Gaming Mouse RGB Backlit Ergonomic Game Mice 7D Esports Wired Mouse for Laptop PC Gamer,2.75,SG$10.98,,,,,,,,No Rating
Original Razer DeathAdder Essential Wired Gaming Mouse Mice 6400DPI Optical Sensor 5 Independently Buttons For Laptop PC Gamer,21.21,SG$53.2,,,,,,,,No Rating
113 Battery Version Mini2.4 GHz Wireless Optical Mouse Portable Mouse Wireless USB Mouse Notebook Computer,1.36,SG$6.4,,,,,,,,No Rating
BM600 Rechargeable Gaming Mouse USB 2.4G Wireless RGB Light Honeycomb Gaming Mouse Desktop PC Computers Notebook Laptop Mice,9.46,SG$30.71,,,,,,,,No Rating
SKYLION F7 Wired 6 Keys Mouse Colorful Lighting Gaming and Office For Microsoft Windows and Apple IOS System,2.37,SG$10.15,,,,,,,,No Rating
Razer DeathAdder Essential Wired Gaming Mouse Mice 6400DPI Optical Sensor 5 Independently Buttons For PC Gamer Black White,8.35,SG$21.13,,,,,,,,No Rating
Delux M800PRO PAW3370 RGB Optical Wireless Gaming Mouse 19000 DPI Wired Programmable Ergonomic Mice Rechargeable For Windows Mac,39.29,SG$94.3,,,,,,,,No Rating
New T66 Rechargeable USB 2.4G Wireless Honeycomb Gaming Mouse RGB Lighting Mice Gamer Mouse For Notebook Desktop PC Computers,12.54,SG$34.28,,,,,,,,No Rating
G304 Light Speed Wireless Mouse Esports Game Lightweight and Portable Wireless Light Speed PC Gamer Same Model for Logitech,5.78,SG$17.74,,,,,,,,No Rating
1 PC ITLY M01 Sports LED Luminous Backlit USB Wired Gaming Mouse for Desktop PC Laptop Office Computer Gaming Mouse,2.49,SG$9.56,,,,,,,,No Rating
GM6 Wired Mouse RGB Mice Wired Computer Mause LED Backlit Ergonomic Gaming Mouse For Laptop PC,2.91,SG$10.22,,,,,,,,No Rating
AJAZZ AJ139 Pro Wireless Mouse with Feets PMW3395 Gaming Chipset 26000dpi Professional Gaming Mouse for PC,37.13,SG$89.38,,,,,,,,No Rating
USB Wired Gaming Mouse 1600 DPI 6 Buttons Silent Mause Backlit Professional Gamer Mice Ergonomic Computer Mouse for PC Laptop,1.73,SG$8.75,,,,,,,,No Rating
Rechargeable Wireless Mouse Gaming Computer Silent Bluetooth Mouse USB Mechanical E-Sports Backlight PC Gamer Mouse For Computer,4.33,SG$14.52,,,,,,,,No Rating
ORZERHOME 2.4GHz Wireless Mouse Optical Mice with USB Receiver Gamer 1600DPI 6 Buttons Mouse For Computer PC Laptop Accessories,3.25,,"2,000+ sold",10,10,10,10,7,https://www.aliexpress.com/item/1005004511906281.html?algo_pvid=67ad0f4f-a7a2-4084-93b5-5ff9f257712b&algo_exp_id=67ad0f4f-a7a2-4084-93b5-5ff9f257712b-17&pdp_npi=4%40dis%21SGD%213.35%213.25%21%21%212.43%212.36%21%402151e66217068440550542949e5d02%2112000029429220558%21sea%21SG%210%21AB&curPageLogUid=7Mmy5wc9vX3V&utparam-url=scene%3Asearch%7Cquery_from%3A,4.7
Limei S1 E Sports LED Luminous Backlit Wired Mouse USB Wired For Desktop Laptop Mute Office Computer Gaming Mouse,1.36,SG$5.96,,,,,,,,No Rating
Rapoo VT9PRO Wireless Gaming Mouse Esports Grade 68g Ultra-Light 26000DPI 8 Buttons Optical PAW3398 Computer Mouse For Laptop PC,43.63,SG$101.6,,,,,,,,No Rating
